[
  {
    "id": "u7-chat-1",
    "ageBand": "under7",
    "pointKey": "strangerChat",
    "textAr": "أحد يكلمك في اللعبة؟ مين هو؟",
    "whyAr": "يعرّفك إذا فيه محادثة أصلًا وهل طفلك ينتبه لوجود أشخاص ثانين في اللعبة.",
    "ifTheySayAr": "إذا قال «إيه، واحد ما أعرفه»: اشكره إنه قال لك، واجلسوا سوا تشوفون مين هو، وقل له: «أي أحد يكلمك تعال ورّني، وما راح أزعل»."
  },
  {
    "id": "u7-chat-2",
    "ageBand": "under7",
    "pointKey": "strangerChat",
    "textAr": "لو جاتك رسالة في اللعبة، وش تسوي؟",
    "whyAr": "تعرف ردة فعله الطبيعية قبل ما يصير شي.",
    "ifTheySayAr": "إذا قال «أرد عليه»: لا تنفعل، قل له بهدوء: «خلنا نتفق، أي رسالة توريني إياها أول ونرد سوا»."
  },
  {
    "id": "u7-chat-3",
    "ageBand": "under7",
    "pointKey": "strangerChat",
    "textAr": "تسمع أصوات ناس يتكلمون وأنت تلعب؟",
    "whyAr": "بعض الألعاب فيها محادثة صوتية، وسؤالك يكشف إذا كانت شغالة عنده.",
    "ifTheySayAr": "إذا قال «إيه»: اسأله وش يقولون، وشوفوا سوا إعدادات الصوت، وقرروا مع بعض تبقونها أو تطفونها."
  },
  {
    "id": "u7-chat-4",
    "ageBand": "under7",
    "pointKey": "strangerChat",
    "textAr": "مين يقدر يكتب لك في اللعبة؟",
    "whyAr": "يساعدك تعرف هل طفلك يفرّق بين الأهل والأصحاب والناس اللي ما يعرفهم.",
    "ifTheySayAr": "إذا قال «ما أدري»: هذي فرصة تكتشفونها سوا، افتحوا الإعدادات وشوفوا مين يقدر يتواصل معه."
  },
  {
    "id": "u7-chat-5",
    "ageBand": "under7",
    "pointKey": "strangerChat",
    "textAr": "لو أحد طلب منك اسمك أو صورتك، وش تقول له؟",
    "whyAr": "يعلّمه بلطف إن فيه معلومات تبقى عنده هو.",
    "ifTheySayAr": "إذا قال «أعطيه»: قل له بهدوء: «اسمك وصورتك أشياء خاصة فيك، إذا أحد طلبها تعال قل لي أول»، وامدحه لأنه جاوب بصراحة."
  },
  {
    "id": "u7-chat-6",
    "ageBand": "under7",
    "pointKey": "strangerChat",
    "textAr": "إذا أحد قال لك كلام يزعّلك في اللعبة، لمين تروح؟",
    "whyAr": "يطمّنه إنك المكان اللي يرجع له بدون خوف من العقاب.",
    "ifTheySayAr": "إذا قال «ما أقول لأحد»: قل له: «أنا أحب أعرف، وما راح آخذ منك اللعبة لأنك قلت لي»، وخلك عند كلامك."
  },
  {
    "id": "u7-purchases-1",
    "ageBand": "under7",
    "pointKey": "purchases",
    "textAr": "فيه أشياء في اللعبة تبي تشتريها؟ وش هي؟",
    "whyAr": "يعرّفك على اللي يشد انتباهه داخل اللعبة.",
    "ifTheySayAr": "إذا قال «إيه، أبي هذا»: اسأله وش يعجبه فيه، واشرح له إن هذي فلوس حقيقية، وقرروا سوا تشترونه أو لا."
  },
  {
    "id": "u7-purchases-2",
    "ageBand": "under7",
    "pointKey": "purchases",
    "textAr": "الجواهر والعملات اللي في اللعبة، من وين تجي؟",
    "whyAr": "الأطفال الصغار ما يربطون دايم العملة اللي في اللعبة بالفلوس الحقيقية.",
    "ifTheySayAr": "إذا قال «تجي ببلاش»: وضّح له ببساطة إن بعضها ينشرى بفلوس بابا أو ماما، وإن أي شراء يمر عليكم أول."
  },
  {
    "id": "u7-purchases-3",
    "ageBand": "under7",
    "pointKey": "purchases",
    "textAr": "لو طلع لك زر «اشترِ»، وش تسوي؟",
    "whyAr": "تعرف هل يضغط أزرار الشراء بدون ما ينتبه.",
    "ifTheySayAr": "إذا قال «أضغطه»: لا تعاتبه، اتفقوا إنه يناديك قبل أي زر فيه شراء، وفعّل خيار طلب الإذن في الجهاز."
  },
  {
    "id": "u7-purchases-4",
    "ageBand": "under7",
    "pointKey": "purchases",
    "textAr": "فيه صناديق أو هدايا تنفتح وما تدري وش فيها؟",
    "whyAr": "صناديق المفاجآت تعتمد على الحظ، وطفلك يحتاج يفهم فكرتها.",
    "ifTheySayAr": "إذا قال «إيه، أحبها»: اسأله وش يحس لما يطلع له شي ما يبيه، وتكلموا سوا إن الحظ أحيانًا يطلع وأحيانًا لا."
  },
  {
    "id": "u7-purchases-5",
    "ageBand": "under7",
    "pointKey": "purchases",
    "textAr": "صاحبك عنده شي في اللعبة وأنت ما عندك؟",
    "whyAr": "مقارنة الأصحاب من الأسباب اللي تخلي الطفل يطلب الشراء.",
    "ifTheySayAr": "إذا قال «إيه، وأبيه»: افهم شعوره أول وقل: «أفهمك، شكله حلو»، وبعدين قرروا سوا: ننتظر، نجمع، أو نخليه."
  },
  {
    "id": "u7-purchases-6",
    "ageBand": "under7",
    "pointKey": "purchases",
    "textAr": "تقدر تلعب وتستانس بدون ما تشتري شي؟",
    "whyAr": "يساعده يلاحظ إن المتعة ما تتوقف على الشراء.",
    "ifTheySayAr": "إذا قال «لا، لازم أشتري»: اسأله وش اللي يحس إنه ناقص، والعبوا سوا وشوفوا وش ممكن تسوون بدون شراء."
  },
  {
    "id": "u7-content-1",
    "ageBand": "under7",
    "pointKey": "content",
    "textAr": "فيه شي في اللعبة يخوّفك؟",
    "whyAr": "يكشف إذا فيه مشاهد أكبر من عمره بدون ما تفترض شي مسبقًا.",
    "ifTheySayAr": "إذا قال «إيه»: صدّقه ولا تقلل من خوفه، خلّه يوريك المشهد، وقرروا سوا تتركونها الحين أو تلعبونها معه."
  },
  {
    "id": "u7-content-2",
    "ageBand": "under7",
    "pointKey": "content",
    "textAr": "وش أكثر شي يعجبك في اللعبة؟",
    "whyAr": "يفتح الكلام بشكل إيجابي ويعرّفك على عالمه.",
    "ifTheySayAr": "إذا قال شي ما توقعته: اسأله «ليش يعجبك؟» واسمعه للنهاية، هذا يبني الثقة لباقي الأسئلة."
  },
  {
    "id": "u7-content-3",
    "ageBand": "under7",
    "pointKey": "content",
    "textAr": "الشخصيات في اللعبة يتضاربون؟ وش تحس لما تشوفهم؟",
    "whyAr": "يعطيك صورة عن نوع العنف إن وُجد وكيف يستقبله طفلك.",
    "ifTheySayAr": "إذا قال «عادي، يضحّك»: اسأله «وفي الحقيقة نسوي كذا؟» وخلّه يفرّق بنفسه بين اللعب والواقع."
  },
  {
    "id": "u7-content-4",
    "ageBand": "under7",
    "pointKey": "content",
    "textAr": "سمعت كلمة في اللعبة ما فهمتها؟",
    "whyAr": "بعض الألعاب فيها ألفاظ، وسؤالك يفتح باب الاستفسار بدون حرج.",
    "ifTheySayAr": "إذا قال «إيه» وكانت كلمة غير لائقة: لا تنصدم قدامه، قل: «هذي كلمة ما نستخدمها»، وشوفوا إذا فيه إعداد يفلتر الكلام."
  },
  {
    "id": "u7-content-5",
    "ageBand": "under7",
    "pointKey": "content",
    "textAr": "ورّني كيف تلعبها؟",
    "whyAr": "أسهل طريقة تعرف فيها المحتوى إنك تشوفه بنفسك.",
    "ifTheySayAr": "إذا قال «لا»: لا تضغط عليه، قل «طيب، متى ما حبيت»، وجرّب تجلس جنبه وقت اللعب بدون تعليقات."
  },
  {
    "id": "u7-content-6",
    "ageBand": "under7",
    "pointKey": "content",
    "textAr": "لو شفت شي يضايقك، وش تسوي؟",
    "whyAr": "يعطيه خطة بسيطة يعرفها قبل ما يحتاجها.",
    "ifTheySayAr": "إذا قال «أكمّل»: قل له «تقدر توقف وتجيني على طول، وما راح أزعل»، وكرّرها بهدوء كل فترة."
  },
  {
    "id": "u7-ads-1",
    "ageBand": "under7",
    "pointKey": "ads",
    "textAr": "يطلع لك فيديو أو إعلان وأنت تلعب؟",
    "whyAr": "بعض الألعاب المجانية فيها إعلانات، وسؤالك يوضّح هل تطلع له.",
    "ifTheySayAr": "إذا قال «إيه، كثير»: اطلب منه يوريك واحد، واشرحوا سوا إن هذا إعلان يبي يبيع شي، وشوفوا إذا فيه نسخة بدون إعلانات."
  },
  {
    "id": "u7-ads-2",
    "ageBand": "under7",
    "pointKey": "ads",
    "textAr": "لما يطلع الإعلان، تضغط عليه؟",
    "whyAr": "الضغط على الإعلان ممكن يطلّعه من اللعبة لمكان ثاني.",
    "ifTheySayAr": "إذا قال «إيه»: لا تلومه، علّمه وين زر الإغلاق، واتفقوا: «إذا ما عرفت تسكّره، نادني»."
  },
  {
    "id": "u7-ads-3",
    "ageBand": "under7",
    "pointKey": "ads",
    "textAr": "تعرف وش يعني إعلان؟",
    "whyAr": "فهم فكرة الإعلان أول خطوة عشان يتعامل معه بوعي.",
    "ifTheySayAr": "إذا قال «لا»: اشرح ببساطة: «هذا مثل اللوحات في الشارع، أحد يبيك تشتري شي»، وخلّه يدوّر إعلان معك ويسمّيه."
  },
  {
    "id": "u7-ads-4",
    "ageBand": "under7",
    "pointKey": "ads",
    "textAr": "الإعلانات تقول لك حمّل ألعاب ثانية؟",
    "whyAr": "بعض الإعلانات تدعو لتحميل تطبيقات ثانية بدون ما ترجع لك.",
    "ifTheySayAr": "إذا قال «إيه، وحمّلت»: شوفوا سوا وش حمّل، وبدون عتاب اتفقوا إن التحميل يكون معك، وفعّل موافقة الأهل في المتجر."
  },
  {
    "id": "u7-ads-5",
    "ageBand": "under7",
    "pointKey": "ads",
    "textAr": "فيه إعلان يقول لك «شوف هذا وتاخذ جائزة»؟",
    "whyAr": "إعلانات الجوائز تخلي الطفل يتفرج أكثر عشان المكافأة.",
    "ifTheySayAr": "إذا قال «إيه، أحبها»: اسأله كم مرة يشوفها، واتفقوا على عدد بسيط، بدون ما تصوّرها كشي سيئ."
  },
  {
    "id": "u7-ads-6",
    "ageBand": "under7",
    "pointKey": "ads",
    "textAr": "لو طلع إعلان فيه شي يخوّف أو غريب، وش تسوي؟",
    "whyAr": "الإعلانات ما تكون دايم مناسبة لعمره.",
    "ifTheySayAr": "إذا قال «أكمّل أشوفه»: قل له «تقدر تسكّره أو تعطيني الجهاز»، وراجع إعدادات الإعلانات أو فكّر في نسخة بدونها."
  },
  {
    "id": "u7-pause-1",
    "ageBand": "under7",
    "pointKey": "sessionPause",
    "textAr": "لما أقول لك «خلاص»، تقدر توقف اللعبة على طول؟",
    "whyAr": "بعض الألعاب ما توقف أو ما تحفظ في أي لحظة، وهذا يفسّر صعوبة التوقف أحيانًا.",
    "ifTheySayAr": "إذا قال «لا، بخسر»: صدّقه وتأكدوا سوا، وعطه تنبيه قبل النهاية بخمس دقايق بدل الإيقاف المفاجئ."
  },
  {
    "id": "u7-pause-2",
    "ageBand": "under7",
    "pointKey": "sessionPause",
    "textAr": "تعرف متى تخلص الجولة؟",
    "whyAr": "معرفة نهاية الجولة تساعدك تختار وقت التوقف المناسب.",
    "ifTheySayAr": "إذا قال «ما أدري»: العبوا سوا جولة وشوفوا متى تخلص، وبعدها اتفقوا: «نوقف بعد ما تخلص الجولة»."
  },
  {
    "id": "u7-pause-3",
    "ageBand": "under7",
    "pointKey": "sessionPause",
    "textAr": "بعد ما يخلص الفيديو، يشتغل غيره لحاله؟",
    "whyAr": "التشغيل التلقائي يخلي الوقت يمر بدون ما ينتبه.",
    "ifTheySayAr": "إذا قال «إيه»: اشرح له إن الجهاز يحاول يخليه يكمّل، وطفّوا التشغيل التلقائي سوا إذا تقدرون."
  },
  {
    "id": "u7-pause-4",
    "ageBand": "under7",
    "pointKey": "sessionPause",
    "textAr": "وش تحس لما توقف اللعبة؟",
    "whyAr": "يساعدك تفهم مشاعره عند التوقف بدل ما تفسّرها عناد.",
    "ifTheySayAr": "إذا قال «أزعل»: قل «طبيعي تزعل، شي ممتع»، واتفقوا على شي حلو يسويه بعد اللعبة."
  },
  {
    "id": "u7-pause-5",
    "ageBand": "under7",
    "pointKey": "sessionPause",
    "textAr": "تبي نختار سوا وقت اللعب اليوم؟",
    "whyAr": "مشاركته في القرار تخفف الشد وقت الإيقاف.",
    "ifTheySayAr": "إذا قال «طول اليوم!»: اضحك معه، وبعدين اعرض خيارين واقعيين وخلّه يختار واحد."
  },
  {
    "id": "u7-pause-6",
    "ageBand": "under7",
    "pointKey": "sessionPause",
    "textAr": "اللعبة تقول لك «ارجع بكرة وخذ هدية»؟",
    "whyAr": "المكافآت اليومية تشد الطفل يرجع كل يوم.",
    "ifTheySayAr": "إذا قال «إيه، لازم أدخل»: طمّنه إن الهدية مو أهم من يومه، واتفقوا على وقت محدد للدخول بدل كل شوي."
  },
  {
    "id": "u7-friends-1",
    "ageBand": "under7",
    "pointKey": "friends",
    "textAr": "مع مين تلعب؟",
    "whyAr": "يعرّفك إذا يلعب لحاله أو مع أحد.",